### ISSUE TITLE
LDAP Authentication failed

### ISSUE THREAD

**Issue by amou1012** [RocketChat/Rocket.Chat#2090]
I want to check my whether my LDAP Authentication works and at first I use the LDAP Test Server : ldap.forumsys.com. Here is my LDAP setting and the following setting is provided by forumsys

> ldap URL : ldap:// ldap.forumsys.com
> ldap port : 389
> ldap DN : dc=example,dc=com
> Bind Search : {"filter": "(&(objectClass=person)(cn=#{username}))", "userDN": "cn=read-only-admin,dc=example,dc=com", "password": "password"} 
> Sync Data : no
> User Data Field Map : {"cn":"name","mail":"email"}

And I got the information at the server console:

```
Bind before search cn=read-only-admin,dc=example,dc=com password
LDAP search dn dc=domain,dc=com
LDAP search options { filter: '(&(objectClass=person)(cn=Louis Pasteur))'}
dc=example,dc=com
LDAP: Search returned 0 record(s)

```
But I used the lpadserach and it works! So, I also use the tecpdump to listen the packet
between my host computer and the forumsys server , 

```
IP xx.xx.xx.xx.xx > xx.xx.xx.xx.xx.ldap: Flags [P.], seq 1:74, ack 1, win 229, options [nop,nop,TS val 50866894 ecr 1047266158], length 73
E..}..@.@...
.R ..}...........G............
..*.>l.n0G...`B....3cn=read-only-admin,dc=example,dc=com..password

IP xx.xx.xx.xx.xx.ldap > xx.xx.xx.xx.xx: Flags [P.], seq 1:23, ack 74, win 260, options [nop,nop,TS val 1047266158 ecr 50866894], length 22
E..Jp~@.y..8..}.
.R ......G....P....<......
>l.n..*.0........a.....
......

IP xx.xx.xx.xx.xx > xx.xx.xx.xx.xx.ldap: Flags [.], ack 23, win 229, options [nop,nop,TS val 50866895 ecr 1047266158], length 0
E..4..@.@...
.R ..}........P..G............
..*.>l.n

IP xx.xx.xx.xx.xx > xx.xx.xx.xx.xx.ldap: Flags [P.], seq 74:195, ack 23, win 229, options [nop,nop,TS val 50866896 ecr 1047266158], length 121
E.....@.@...
.R ..}........P..G............
..*.>l.n0w...cr.*dc=example,dc=com
..
.......
....3....cn.
Louis Pasteur0.

IP xx.xx.xx.xx.xx.ldap > xx.xx.xx.xx.xx: Flags [P.], seq 23:45, ack 195, win 259, options [nop,nop,TS val 1047266159 ecr 50866896], length 22
E..Jp.@.y..6..}.
.R ......G.........;,.....
>l.o..*.0........e.....
......

IP xx.xx.xx.xx.xx > xx.xx.xx.xx.xx.ldap: Flags [.], ack 45, win 229, options [nop,nop,TS val 50866907 ecr 1047266159], length 0
E..4..@.@...
.R ..}...........G......L.....
..*.>l.o
```

The tcpdump seems it has no finish flag [F.]....
My Rocketchat version is 13.0
Is my setting wrong or do I miss something?

**Comment by rodrigok** [comment]
This is still a problem?

**Comment by engelgabriel** [comment]
Hi @amou1012  can you try the latest develop branch and reopen this issue if this is still a problem?
